{
  "schema_version": 1,
  "provider": "postgres",
  "provider_version": "17.5",
  "extension_versions": {
    "postgis": "3.5.2"
  },
  "reads": {
    "streaming": true,
    "server_cursor": false,
    "pagination": false,
    "object_id_windows": false,
    "projection": true,
    "filter": true,
    "ordering": true,
    "resumable": false
  },
  "writes": {
    "create": true,
    "append": true,
    "update": true,
    "upsert": true,
    "replace": true,
    "delete_by_keys": true,
    "bulk": true,
    "array_binding": false,
    "returning": false,
    "apply_edits": false,
    "rollback_on_failure": true,
    "use_global_ids": false
  },
  "transactions": {
    "single_transaction": true,
    "savepoints": false,
    "transactional_ddl": true,
    "staged_swap": true,
    "scope": "transaction"
  },
  "spatial": {
    "read_wkb": true,
    "write_wkb": true,
    "geometry": true,
    "geography": true,
    "spatial_index": true,
    "mixed_geometry_types": true,
    "dimensions": [
      "xy",
      "xyz",
      "xym",
      "xyzm"
    ]
  },
  "limits": {
    "max_identifier_bytes": 63,
    "max_bind_parameters": 65535,
    "max_statement_bytes": null,
    "max_batch_rows": null,
    "max_payload_bytes": null,
    "max_record_count": null
  }
}
